{
  "deckode": "0.1.0",
  "meta": {
    "title": "Deckode Feature Showcase",
    "author": "Son",
    "aspectRatio": "16:9"
  },
  "theme": {
    "slide": {
      "background": {
        "color": "#ffffff"
      }
    },
    "text": {
      "fontSize": 18,
      "color": "#1e293b",
      "lineHeight": 1.6
    },
    "code": {
      "fontSize": 14,
      "borderRadius": 8
    },
    "shape": {
      "borderRadius": 8
    }
  },
  "slides": [
    {
      "id": "title",
      "notes": "Title slide with onEnter animations.",
      "elements": [
        {
          "id": "title-text",
          "type": "text",
          "content": "# Deckode Feature Showcase",
          "position": { "x": 130, "y": 140 },
          "size": { "w": 700, "h": 80 },
          "style": {
            "fontSize": 48,
            "color": "#0f172a",
            "textAlign": "center",
            "verticalAlign": "middle"
          }
        },
        {
          "id": "title-sub",
          "type": "text",
          "content": "Every feature in one deck",
          "position": { "x": 230, "y": 240 },
          "size": { "w": 500, "h": 40 },
          "style": {
            "fontSize": 24,
            "color": "#94a3b8",
            "textAlign": "center"
          }
        },
        {
          "id": "title-divider",
          "type": "shape",
          "shape": "rectangle",
          "position": { "x": 380, "y": 310 },
          "size": { "w": 200, "h": 4 },
          "style": { "fill": "#3b82f6" }
        },
        {
          "id": "title-badge",
          "type": "shape",
          "shape": "ellipse",
          "position": { "x": 830, "y": 20 },
          "size": { "w": 100, "h": 100 },
          "style": {
            "fill": "transparent",
            "stroke": "#3b82f6",
            "strokeWidth": 2,
            "opacity": 0.4
          }
        },
        {
          "id": "title-version",
          "type": "text",
          "content": "v0.1",
          "position": { "x": 847, "y": 50 },
          "size": { "w": 66, "h": 30 },
          "style": {
            "fontSize": 14,
            "color": "#3b82f6",
            "textAlign": "center"
          }
        },
        {
          "id": "title-nav",
          "type": "text",
          "content": "Press **Space** or **ArrowRight** to advance",
          "position": { "x": 280, "y": 480 },
          "size": { "w": 400, "h": 30 },
          "style": {
            "fontSize": 14,
            "color": "#475569",
            "textAlign": "center"
          }
        }
      ],
      "animations": [
        { "target": "title-text", "trigger": "onEnter", "effect": "fadeIn", "duration": 600 },
        { "target": "title-sub", "trigger": "onEnter", "effect": "slideInUp", "duration": 500, "delay": 300 },
        { "target": "title-divider", "trigger": "onEnter", "effect": "scaleIn", "duration": 400, "delay": 600 },
        { "target": "title-badge", "trigger": "onEnter", "effect": "scaleIn", "duration": 500, "delay": 400 }
      ]
    },
    {
      "id": "text-math",
      "transition": { "type": "slide", "duration": 400 },
      "notes": "Text/Markdown rendering with inline and display KaTeX math.",
      "elements": [
        {
          "id": "tm-title",
          "type": "text",
          "content": "## Text & Math",
          "position": { "x": 60, "y": 20 },
          "size": { "w": 840, "h": 45 },
          "style": { "fontSize": 36, "color": "#0f172a" }
        },
        {
          "id": "tm-desc",
          "type": "text",
          "content": "Full **Markdown** with inline `$...$` and display `$$...$$` KaTeX math.",
          "position": { "x": 60, "y": 65 },
          "size": { "w": 840, "h": 25 },
          "style": { "fontSize": 16, "color": "#64748b" }
        },
        {
          "id": "tm-markdown",
          "type": "text",
          "content": "**Rich text** supports *italic*, `inline code`, ~~strikethrough~~, and [links](https://deckode.dev).\n\nInline math: the quadratic formula $x = \\frac{-b \\pm \\sqrt{b^2 - 4ac}}{2a}$ renders in text flow.",
          "position": { "x": 60, "y": 100 },
          "size": { "w": 840, "h": 60 },
          "style": { "fontSize": 16, "color": "#475569", "lineHeight": 1.6 }
        },
        {
          "id": "tm-bg",
          "type": "shape",
          "shape": "rectangle",
          "position": { "x": 40, "y": 175 },
          "size": { "w": 880, "h": 340 },
          "style": { "fill": "#1e293b", "borderRadius": 16 }
        },
        {
          "id": "tm-schrodinger",
          "type": "text",
          "content": "**Schr\u00f6dinger Equation**\n\n$$i\\hbar \\frac{\\partial}{\\partial t}\\Psi(\\mathbf{r},t) = \\left[-\\frac{\\hbar^2}{2m}\\nabla^2 + V(\\mathbf{r},t)\\right]\\Psi(\\mathbf{r},t)$$",
          "position": { "x": 60, "y": 190 },
          "size": { "w": 420, "h": 140 },
          "style": { "fontSize": 16, "color": "#e2e8f0", "lineHeight": 1.4 }
        },
        {
          "id": "tm-einstein",
          "type": "text",
          "content": "**Einstein Field Equations**\n\n$$R_{\\mu\\nu} - \\tfrac{1}{2}R\\,g_{\\mu\\nu} + \\Lambda g_{\\mu\\nu} = \\frac{8\\pi G}{c^4}T_{\\mu\\nu}$$",
          "position": { "x": 500, "y": 190 },
          "size": { "w": 400, "h": 140 },
          "style": { "fontSize": 16, "color": "#e2e8f0", "lineHeight": 1.4 }
        },
        {
          "id": "tm-maxwell",
          "type": "text",
          "content": "**Maxwell's Equations**\n\n$$\\nabla \\cdot \\mathbf{E} = \\frac{\\rho}{\\varepsilon_0}, \\quad \\nabla \\times \\mathbf{E} = -\\frac{\\partial \\mathbf{B}}{\\partial t}, \\quad \\nabla \\cdot \\mathbf{B} = 0, \\quad \\nabla \\times \\mathbf{B} = \\mu_0\\mathbf{J} + \\mu_0\\varepsilon_0\\frac{\\partial \\mathbf{E}}{\\partial t}$$",
          "position": { "x": 60, "y": 340 },
          "size": { "w": 840, "h": 80 },
          "style": { "fontSize": 16, "color": "#e2e8f0", "lineHeight": 1.4 }
        },
        {
          "id": "tm-matrix",
          "type": "text",
          "content": "**Matrix Multiplication**\n\n$$\\begin{pmatrix} a & b \\\\ c & d \\end{pmatrix} \\begin{pmatrix} e & f \\\\ g & h \\end{pmatrix} = \\begin{pmatrix} ae+bg & af+bh \\\\ ce+dg & cf+dh \\end{pmatrix}$$",
          "position": { "x": 60, "y": 430 },
          "size": { "w": 430, "h": 80 },
          "style": { "fontSize": 15, "color": "#e2e8f0", "lineHeight": 1.4 }
        },
        {
          "id": "tm-svd",
          "type": "text",
          "content": "**SVD Decomposition**\n\n$$A = U\\Sigma V^T = \\begin{bmatrix} u_1 & \\cdots & u_m \\end{bmatrix} \\begin{bmatrix} \\sigma_1 & & \\\\ & \\ddots & \\\\ & & \\sigma_r \\end{bmatrix} \\begin{bmatrix} v_1^T \\\\ \\vdots \\\\ v_n^T \\end{bmatrix}$$",
          "position": { "x": 500, "y": 430 },
          "size": { "w": 410, "h": 80 },
          "style": { "fontSize": 15, "color": "#e2e8f0", "lineHeight": 1.4 }
        }
      ]
    },
    {
      "id": "shapes",
      "transition": { "type": "fade", "duration": 300 },
      "notes": "Showcase shape kinds and configurable markers: rectangle, ellipse, line, arrow, double-headed, curved path.",
      "elements": [
        {
          "id": "shapes-title",
          "type": "text",
          "content": "## Shape Elements",
          "position": { "x": 60, "y": 30 },
          "size": { "w": 840, "h": 50 },
          "style": { "fontSize": 36, "color": "#0f172a" }
        },
        {
          "id": "shapes-desc",
          "type": "text",
          "content": "Four shape kinds with configurable fill, stroke, border radius, and opacity.",
          "position": { "x": 60, "y": 80 },
          "size": { "w": 840, "h": 30 },
          "style": { "fontSize": 16, "color": "#64748b" }
        },
        {
          "id": "shape-rect",
          "type": "shape",
          "shape": "rectangle",
          "position": { "x": 60, "y": 140 },
          "size": { "w": 180, "h": 120 },
          "style": { "fill": "#3b82f6", "borderRadius": 12 }
        },
        {
          "id": "shape-rect-label",
          "type": "text",
          "content": "**rectangle**\nborderRadius: 12",
          "position": { "x": 70, "y": 270 },
          "size": { "w": 160, "h": 40 },
          "style": { "fontSize": 13, "color": "#94a3b8", "textAlign": "center" }
        },
        {
          "id": "shape-ellipse",
          "type": "shape",
          "shape": "ellipse",
          "position": { "x": 290, "y": 140 },
          "size": { "w": 180, "h": 120 },
          "style": { "fill": "transparent", "stroke": "#8b5cf6", "strokeWidth": 3 }
        },
        {
          "id": "shape-ellipse-label",
          "type": "text",
          "content": "**ellipse**\nstroke only",
          "position": { "x": 300, "y": 270 },
          "size": { "w": 160, "h": 40 },
          "style": { "fontSize": 13, "color": "#94a3b8", "textAlign": "center" }
        },
        {
          "id": "shape-line",
          "type": "shape",
          "shape": "line",
          "position": { "x": 520, "y": 170 },
          "size": { "w": 180, "h": 60 },
          "style": { "stroke": "#f59e0b", "strokeWidth": 3 }
        },
        {
          "id": "shape-line-label",
          "type": "text",
          "content": "**line**\nstrokeWidth: 3",
          "position": { "x": 530, "y": 270 },
          "size": { "w": 160, "h": 40 },
          "style": { "fontSize": 13, "color": "#94a3b8", "textAlign": "center" }
        },
        {
          "id": "shape-arrow",
          "type": "shape",
          "shape": "arrow",
          "position": { "x": 750, "y": 160 },
          "size": { "w": 150, "h": 80 },
          "rotation": 15,
          "style": { "stroke": "#ec4899", "strokeWidth": 3 }
        },
        {
          "id": "shape-arrow-label",
          "type": "text",
          "content": "**arrow**\nrotation: 15\u00b0",
          "position": { "x": 745, "y": 270 },
          "size": { "w": 160, "h": 40 },